"id","title","body","created_at"
"1","bootsrap","Bootstrap supports all the HTML5 input types: text, password, datetime, datetime-local, date, month, time, week, number, email, url, search, tel, and color.

Note: Inputs will NOT be fully styled if their type is not properly declared!","1381009509"
"2","spacetrum","

Where ignorance lurks, so too do the frontiers of discovery and imagination.

We want to explore. We’re curious people. Look back over history, people have put their lives at stake to go out and explore … We believe in what we’re doing. Now it’s time to go.

Astronomy compels the soul to look upward, and leads us from this world to another.

The path of a cosmonaut is not an easy, triumphant march to glory. You have to get to know the meaning not just of joy but also of grief, before being allowed in the spacecraft cabin.

There can be no thought of finishing for ‘aiming for the stars.’ Both figuratively and literally, it is a task to occupy the generations. And no matter how much progress one makes, there is always the thrill of just beginning.","1381003509"
